{
  "schema": "phil-ai-os-project-observation",
  "version": 1,
  "project_id": "rubys-cake-delights-hq",
  "source_kind": "committed_readiness",
  "observed_at": "2026-09-17",
  "freshness": "stale",
  "facts": {
    "ref": "ops/readiness/ruby-first-party-quick-pickup-readiness.json",
    "production_activation_ready": false
  },
  "authority": {
    "authority_effect": "none",
    "mutation_authorized": false
  }
}
